;title;year;directors;rating;genres;plot
271;The Pirate's Gold;1908;D.W. Griffith;5.5;Short Action;"Young Wilkinson is leaving his dear old mother for a journey to seek his fortune in a foreign clime. Now, the little cottage is situated near the coast. The waters of the sea have been infested with a band of gold-thirsty pirates, who pillaged every ship that came their way. Having successfully perpetuated one of their nefarious exploits, they are struck by a storm and forced to put out from their floundering vessel in a small yawl, in which they place a chest of valuables, for the shore. Thrown up on the coast by the voluminous waves, they disembark; there are three of them, the chief and two underlings. Taking the chest to a place of safety, they proceed to divide the spoils. A contention arises, and the two turn on their chief, who strikes down one of them at once, but is stabbed in the back by the other, whom he afterwards strangles. Gathering up the treasure, he struggles along, his life's blood oozing from the wound inflicted by the mutinous pirate, until he comes to the cottage of Wilkinson. A terrific storm is still raging and the poor old mother is trying to shut out the force of the gale when the chief staggers in. He begs her to hide the gold, which she does by dislodging several bricks in the fireplace and placing the treasure behind them. This is hardly done when the pirate chief drops dead from the loss of blood and the poor woman is felled by lightning. Hence, the hiding place is seemingly an eternal secret. What a sad home-coming it is for the son, after his success abroad. A year later, however, we find him a happy bridegroom and the sun again shines on the household. But eight years later he is stricken ill, with nothing in store for his wife and little one. The process server has seized the effects, and despondingly he goes to the kitchen to put an end to his unendurable existence. The good wife, suspicious, follows and just as he puts a pistol to his head she strikes his arm, causing the bullet to crash into the fireplace, splintering the bricks and disinterring the hidden treasure.::Moving Picture World synopsis"
272;The Planter's Wife;1908;D.W. Griffith;5.3;Short Action Drama;"John Holland, a planter in a small way, is devotedly attached to his wife and infant child. The wife wearies of the monotonous grind of farm life and is easy prey of a contemptible villain, in the person of Tom Roland, the ubiquitous ""other man,"" fate ordains it so. The wife's sister is an innocent, good-natured tomboy girl, who never for a moment dreamed that her sister's low spirits were due to anything else than ill-health; no more did John. He tries his best to cheer his wife, and as he bids her and the baby a fond adieu in the morning on his departure for the fields, he begs her to be hopeful, that better conditions are in store. Scarcely has he crossed the threshold when Roland appears at the window. This decides her; so taking her wedding ring from her finger and leaving a note of farewell, she elopes with the serpent. At that moment the sister enters, sees the note and determines to save her at any cost. Donning her riding bloomers, and armed with a revolver, she leaps on a horse and dashes wildly after them, they having escaped in a phaeton. On, on they go at breakneck speed, both holding the distance between them, until the harness breaks on the horse of the elopers and they resort to a rowboat to get across the river. Down comes the sister, and leaping from her horse, dashes to the landing, and with the aid of her gun enlists the services of the old boatman to row in pursuit. Masking her face, that her identity will be unknown, she fires at the fleeing couple, causing them to heave to. Coming abreast, and flourishing the gun, she compels Roland to leap overboard and swim off. Then she commands the wife to board her boat, and at the landing, to return home. Here she makes herself known, and in a struggle the wife gets possession of the gun, when in rushes Roland and seizing the sister is choking her, when kin asserts itself in the wife and she sends a bullet crashing through Roland's arm, who at the point of the gun is driven from the place. The wife, realizing her folly, as John enters throws herself in his arms, he being in total ignorance of her experience and narrow escape. Once more, and for all time, peace reigns in the little home, thanks to Tomboy Nellie.::Moving Picture World synopsis"
273;The Reckoning;1908;D.W. Griffith;7.9;Drama Short;"We find a couple struggling for a livelihood, meager though it needs must be. The husband seemed content in the struggle, working at the factory for the pittance he received, but his love for his wife made the labor light. On the other hand, to the young wife this condition was most odious. In the grind of household duties, having, from force of circumstances, to do them all unassisted, she was like a flower withering for want of sunshine. Hence it was not surprising that she listened avidiously to the flattering platitudes of the unconscionable tempter. In the first scene we see her at the ironing table, while her husband bids her a tender adieu on his departure for work. Hardly has he left the threshold, when the grocer's clerk enters, and is received with an effusiveness most unplatonic. They at once proceed to enjoy a little lunch, the ingredients of which the clerk has brought in a basket. Meanwhile the husband arrives at the factory, only to find it closed down. Retracing his steps he arrives home, and seeing the window down and the shade closed, his suspicions are aroused. Stealthily raising the window and lifting the shade slightly, his fears are confirmed. His action, quiet though it be, startles the lovers, who leave the lunch table and hide behind a sheet hanging across the room. Entering, the husband, with gaze riveted on the sheet, picks up a pistol and sits himself in front of their hiding place, calmly lights his pipe and waits. At length he beckons, ""Come out."" (This is undoubtedly the most tense situation ever attempted in motion pictures.) The clerk appears first, followed by wife, and the reckoning is paid.::Moving Picture World synopsis"
274;The Red Girl;1908;D.W. Griffith;5.1;Action Short;Kate Nelson, a girl miner who has been working a claim in the mountains, runs into the office of the frontier hotel with the tidings that she has at last struck paydirt, showing a bag of valuable nuggets to admiring friends. Having just returned from the appraiser's office, and it being late, she puts up at the hotel for the night. In the office at Kate's arrival there is a Mexican woman who has just lost her money at Faro. At sight of Kate's gold she becomes desperate and at once plans to secure it. Kate is shown to a room, and is soon asleep with the bag of yellow nuggets reposing under her pillow. Suddenly the face of the Mexican woman is seen at the window, and she has little trouble in forcing it open. Her intrusion awakens Kate, but she overpowers her and gains the gold in the struggle. Kate manages to fire her revolver, with a view to bring aid, but all too late, for the thief makes good her escape, leaving behind on the door an incriminating mantilla, which discovers the identity of the culprit. A chase is made after the fugitive, the hotel clerk, friend of Kate's, leading the way. This poor fellow, however, is dropped in his tracks by a bullet from the woman's gun in ambush. Distancing her pursuers, the Mexican woman comes upon an Indian girl, who, with her half-breed husband, are camped alongside the river. The Red Girl bides the Mexican woman and throws the searching posse on the wrong trail. In return for the kindly act on the part of the Red Girl, the Mexican woman plies her wiles on the half-breed husband, not only taking him away, but inducing him to kill his wife. To this end they plan a torture. Binding her hands and feet, they take her to a large trunk of a dead tree, which overhangs the river, and here they hang her, like Tantalus, suspended between water and sky. With her teeth she manages to free one of her hands and with an ornament on her necklace contrives to saw the rope and drop into the water. Swimming to the shore she again meets Kate and her friends, and volunteers to become their guide in running down the miscreants, who have embarked in a canoe and are rapidly paddling down the river. Into another canoe the pursuers leap and are soon shortening the distance between themselves and the scoundrels, until at length they come up with them, and a hand-to-hand conflict ensues, during which both canoes are capsized, and a terrific struggle in the water ends with the overpowering of the pair and arrest of the Mexican Jezebel. The dip in the river has evidently chilled the half-breed's ardor for the Mexican woman, for he tries to return to the Red Girl, but she repulses him, and we leave her and Kate standing on the cliff, enfolded in each other's arms, bathed in the golden rays of a setting sun. Indeed a most beautiful scene.::Moving Picture World synopsis
275;The Red Man and the Child;1908;D.W. Griffith;6.0;Western Short Action;Alongside of a beautiful mountain stream in the foothills of Colorado there camped a Sioux Indian, who besides being a magnificent type of the aboriginal American, is a most noble creature, as kind-hearted as a woman and as brave as a lion. He eked his existence by fishing, hunting and mining, having a small claim which he clandestinely worked, hiding his gains in the trunk of an old tree. It is needless to say that he was beloved by those few who knew him, among whom was a little boy, who was his almost constant companion. One day he took the little fellow to his deposit vault, the tree trunk, and showed him the yellow nuggets he had dug from the earth, presenting him with a couple of them. In the camp there were a couple of low-down human coyotes, who would rather steal than work. They had long been anxious to find the hiding place of the Indian's wealth, so capture the boy, and by beating and torture compel him to disclose its whereabouts. In the meantime there has come to the place a couple of surveyors who enlist the services of the Indian to guide them to the hilltop. Here they arrive, set up their telescope and start calculations. An idea strikes them to allow the Indian to look through the 'scope. He is amazed at the view, so close does it bring the surrounding country to him. While his eye is at the glass one of the surveyors slowly turns it on the revolving head until the Indian starts back with an expression of horror, then looks again, and with a cry of anguish dashes madly away down the mountain side, for the view was enough to freeze the blood in his veins. Arriving at the old tree trunk, his view through the telescope is verified, for there is the result he improvised bank rifled, and the old grandfather of the little boy, who had followed the miscreants murdered. Picking the old man up he carries his lifeless form back to the camp, reaching there just after the murderers, with the boy, had decamped in a canoe. Laying the body on the sands and covering it tenderly with his shawl he stands over it and solemnly vows to be avenged. What a magnificent picture he strikes as he stands there, his tawny skin silhouetted against the sky, with muscles turgid and jaws set in grim determination. It is but for a moment he stands thus, yet the pose speaks volumes. Turning quickly, he leaps into a canoe at the bank and paddles swiftly after the fugitives. On, on goes the chase, the Indian gaining steadily on them, until at last abandoning hope, they leave their canoe and try to wade to shore as the Indian comes up. Leaping from his boat he makes for the pair, seizing one as the other swims to the opposite shore. Clutching him by the throat the Indian forces his head beneath the surface of the water and holds it there until life is extinct, after which he dashes in pursuit of the other. This proves to be a most exciting swimming race for a life. They reach the other shore almost simultaneously, and a ferocious conflict takes place on the sands terminating in the Indian forcing his adversary to slay himself with his own dagger. Having now fulfilled his vow he leaps into the water and swims back to the canoe in which sits the terrified boy, and as night falls he paddles slowly back to camp.::Moving Picture World synopsis
276;Rescued from an Eagle's Nest;1908;J. Searle Dawley;5.7;Action Short;A family is terrified when an eagle carries off its young child.::Snow Leopard A woodcutter says good-bye to his wife and child, and then goes off to work. After he has left, the mother leaves the child outside their cabin to play. Suddenly, an eagle swoops down and carries off the child. When the mother realizes what has happened, she runs to tell her husband. He and the other lumberjacks immediately set out to find and rescue the child.::Snow Leopard
277;Romance of a Jewess;1908;D.W. Griffith;5.4;Drama Short;"This early D.W. Griffith short shows the director's interest in Jewish ghetto life, portrayed here with sympathy and sentimentality. The melodramatic plot involves the conflict between generations in an immigrant Jewish family.::National Center for Jewish Film Ruth Simonson, with her father, is seen kneeling at the bedside of her mother, whose sands of life are rapidly ebbing. Realizing her end near, Mrs. Simonson takes from her neck a chain and locket and places it around the neck of her daughter, Ruth, with the prayerful injunction that she be ever guided in the path of prudence and virtue by this memorial. Commending her to the care of her father, the old lady goes to meet her Master in the Great Beyond. Two years later we find Ruth assisting her old father in his pawnshop. Mr. Simonson, although a money-lender, is benevolent in nature and his many deeds of munificence have endeared him to all who know him. Hence, when the local schatchen appears with Jacob Rubenstein, a wealthy suitor for his daughter's hand, it was his desire for her future happiness that induced him to look with favor on him. Ruth, however, had given her heart to Sol Bimberg, an impecunious bookseller in the neighborhood. While Mr. Simonson has no aversion for Sol, still to wed his daughter is out of the question, as his prospects are very poor. Ruth is determined, and when it comes to choosing between her father and her lover, she accepts the latter. Seven years later the little family, increased by a child, are living happily, when a fall from a ladder causes the death of Sol. Ruth, finding business cares too much for her, is forced to sell out to Rubenstein. The pittance realized from the sale does not last long, and poor Ruth is stricken down with the dread disease that carried off her mother. Reduced to poverty, she is forced to send the little girl to the pawnshop with the locket, on which to raise enough to buy a bit of bread. At the pawnshop, old Simonson recognizes the locket, and his heart at once softens, so he goes with the child to the garret, where he arrives just in time to reconcile his lost one when she breathes her last. Crushed and heartbroken, the old man folds her child, his granddaughter, to his breast, which forms the closing scene of a most touching and heart-stirring film. Several of the scenes arc decidedly interesting in the fact that they were actually taken in the thickly settled Hebrew quarters of New York City.::Moving Picture World synopsis A pawn shop. A man arranges a marriage with the owner's daughter, but she declines for love. The couple is cut off, and opens a book shop; some years later, he dies in a fall from a ladder. She is despondent; her daughter goes to seek help, and ends up a customer at her grandfather's pawn shop, not knowing the connection.::Jon Reeves <jreeves@imdb.com>"
278;Romeo and Juliet;1908;J. Stuart Blackton;7.1;Short Drama Romance;Two feuding houses are united with the marriage and eventual death of their children.::Anonymous
279;The Dream of an Opium Fiend;1908;Georges Méliès;5.7;Short;"The opium fiend is seen in a den, puffing on this terrible narcotic. He then falls fast asleep and dreams that he is at home with his wife. He asks for something to drink and he is given wine, which he does not care for, and he is finally given some bottled beer and a glass, but he complains that the glass is too small and he gets a very large sized glass receptacle, into which his wife and maid servant pour the contents of the bottle. As he is about to drink the glass passes from his hand mysteriously, sailing through the room and out of the window to the moon, which drinks the beer and the empty glass is returned to its owner by Diana, who rides below on her crescent moon. The opium fiend tries many times to embrace her, but she always disappears from her original position; and once, when he almost gets her, she has changed into a most ugly creature. He hurls at this hideous transformation everything within his reach. The scene then changes, showing the fiend, awake, throwing the different things at the Chinaman attendant of the opium den.::Moving Picture World synopsis"
280;The Sculptor's Nightmare;1908;Wallace McCutcheon;5.4;Comedy Short;At a political club, the members debate whose bust will replace that of Theodore Roosevelt. Unable to agree, each goes to a sculptor's studio and bribes him to sculpt a bust of the individual favorite. Instead, the sculptor spends their fees on a dinner with his model during which he becomes so inebriated that he is taken to jail. There he has a nightmare, wherein three busts are created and animated from clay (through stop-motion photography) in the likenesses of Democrat William Jennings Bryan and Republicans Charles W. Fairbanks and William Howard Taft. Finally an animated bust of Roosevelt appears.::Fiona Kelleghan <fkelleghan@aol.com>
281;Sherlock Holmes II: Raffles Escaped from Prison;1909;Viggo Larsen;7.6;Short Comedy;Raffles is serving his time. He manages to send a word to his friends and they help him to escape. Once free, Raffles' first thought is to revenge himself on Sherlock Holmes, and for this he enlists the services of a pretty but depraved girl, to decoy the great detective to an old house, where he is met by Raffles under the disguise of an old woman. Sherlock Holmes, taken by surprise, is thrown through a masked opening in the wall, into an old sewer. When Raffles and his associates discover that Sherlock Holmes has been rescued, they plan a second attempt on his life. Raffles takes lodgings opposite the detective's home and watches for a good chance to fire his gun at Sherlock Holmes. Young Billy, the alert office boy, discovers the strange new tenant and notifies his master. Sherlock Holmes, guessing the intentions of the criminal, pulls down the window blinds and arranges a dummy at the window. At a given moment, Billy pulls up the blinds and Raffles, who had been watching for a good opportunity, takes up his gun and shoots. He hits the dummy, but great is his surprise when leaving the window, to find himself face to face with Sherlock Holmes in flesh. As Raffles turns to run away, he is caught by two officers.::Moving Picture World synopsis
282;The Song of the Shirt;1908;D.W. Griffith;6.1;Drama Short;Struggling with poverty and the declining health of a relative, a young woman struggles to find employment.::cupcakes
283;The Stolen Jewels;1908;D.W. Griffith;6.8;Drama Short;It would have taken more than the wonderful powers of deduction of a Sherlock Holmes to have dispelled the mystery that shrouded the disappearance of a case of jewels at the home of Robert Jenkins, a wealthy stockbroker, and although they were eventually brought to light, it was through a most remarkable accident. Mr. and Mrs. Jenkins are getting ready for an evening at the opera, and. as usual Mrs. Jenkins is tantalizingly slow in her preparations, and is almost carried out of the house by the impatient Jenkins. Baby Jenkins is very much in evidence, and requires a bribe to induce her to remain contented with the maid. This Mrs. J. furnishes in the shape of a papier-maché doggie, the head of which is removed to find its interior filled with candy. Mrs. Jenkins is inclined to deck herself out in her diamonds, and takes the case from the strong-box, but in her anxiety to appease her husband's flustering, she hurriedly kisses baby and departs, forgetting all about the jewels. They are not long in the theater before the thought of the diamonds comes to her, and the awful possible result of her carelessness. She will not rest until Mr. Jenkins takes her home. On arriving there, sure enough her worst fears are apparently confirmed. There on the desk lies the jewel case empty. Good heavens! what's to be done? No one was in the house but the baby and nurse, both of whom are now abed. There is no trace or sign of the entrance of a thief. How did it happen? Well, the detectives are summoned and put to work on the case, but without success, although a reward of $10,000 is offered for the apprehension of the robbers and return of the jewels. The detectives finally give the matter up. Poor Jenkins is certainly up against it, for the loss of the jewels is the beginning of a streak of wretched luck. He is beaten on all sides in the stock market until at length he is forced to the wall. Poverty, disgrace and even starvation stare him and his loved ones in the face. Forced to sell his house and then the furniture to satisfy his creditors, he is in the depths of despair as he stands and views his precious little one playing on the floor with her doggie, unconscious of the anguish of her father. Piece by piece the household effects are seized, until there remains but a couple of chairs, on one of which Baby places her doggie. At that moment the door opens and Smithson, Jenkins' friend, enters to offer his sympathy and aid. Smithson is a good hearted, blustering fellow, and in the enthusiasm of his friendship, flusters about, finally throwing himself into the only chair in the room, not noticing the toy, of course crushing it to atoms. Leaping to his feet, he is profuse in apologies, when, lo and behold! there among the fragments of the broken dog lay the diamonds. The clouds that hung over the household are dissipated and the little family may start anew. There are many sensational incidents in the course of the film, one showing the curb market of New York is most unique.::Moving Picture World synopsis
284;Knight of Black Art;1908;Georges Méliès;5.2;Short;"We are introduced to the banqueting hall of an old-time castle. Servitors stand awaiting the arrival of their master, who, appearing on the scene, throws his cloak to an attendant; unbuckling his sword, he hands him that also, then at the word of command the attendant throws them upward and they vanish. The knight then takes two large rings, a sheet of paper, which he places on one of the rings, then fitting the other over the paper draws it taut as a drum. Two attendants then hold the paper-covered rings upright, another hands a paint brush and paint to the knight, who proceeds to draw a face on the paper. This at a sign changes into a laughing, roguish character. The knight then plunges his arms through the eyes of the figure and draws therefrom bottles of wine which he hands to an attendant who surreptitiously drinks their contents. Making an incision where the mouth is drawn, our knight takes therefrom shawls, scarves and wraps of the finest texture. Taking the rings from the attendants, he turns it about to show there is nothing further therein, he hands it back and again draws this time four magnificent ladies' costumes, which he hands to his helper, He now takes the rings from the two pages and rolling them off the scene stands the boys in center of the hall, fuming them round he produces two other pages from them, then throwing the costumes to the four, who donning them are changed into four ladies who go through a graceful dance. Taking off the dresses, they change again to pages; the four become two and vanish from view. The knight takes a ring, ties four ropes to it, and, suspending it in mid-air, calls a page, who sits under it. Then from the ring there gradually ascends a fairy form, who at a sign again descends. The knight next causes a pedestal to appear, standing thereon he holds aloft one of the rings, which gradually lowers itself on the knight who disappears; appearing from another side, he takes the two rings, placing them edge to edge they form a cycle, which the knight mounts and rides away.::Moving Picture World synopsis"
285;The Taming of the Shrew;1908;D.W. Griffith;5.8;Short Comedy Romance;Based on Shakespeare's play: Petruchio courts the bad-tempered Katharina, and tries to change her aggressive behavior.::Snow Leopard Based on Shakespeare's play: Two suitors have come to the home of the popular Bianca to court her. But her bad-tempered sister Katharina interrupts, deals with the men roughly and chases them out. Later she also assaults her music teacher. Only Petruchio, just arrived in town, wants to court Katharina. Her father eagerly agrees to arrange a wedding, and soon Petruchio and Katharina are locked in a battle of wills.::Snow Leopard
