;title;year;directors;rating;genres;plotmarks
0;Carmencita;1894;William_K.L._Dickson;5.8;Documentary Short;Performing on what looks like a small wooden stage wearing a dress with a hoop skirt and white highheeled pumps Carmencita does a dance with kicks and twirls a smile always on her face Presumably the first woman ever to appear in a Kinetoscope film and possibly the first woman to take part in a motion picture in the United States the Spaniard dancer Carmencita performs her appealing highkick dance in front of the camera of William KL Dickson and William Heise for Thomas Edison In this segment of her New York musichall act she spins and twirls exhibiting an admirable talent a fashionable dress and a really charming smile
1;Le clown et ses chiens;1892;Émile_Reynaud;6.4;Animation Short;Short film of 300 individually painted images
2;Pauvre Pierrot;1892;Émile_Reynaud;6.6;Animation Comedy Short Romance;One night Arlequin come to see his lover Colombine But then Pierrot knocks at the door and Colombine and Arlequin hide Pierrot starts singing but Arlequin scares him and the poor man goes away
3;Blacksmith Scene;1893;William_K.L._Dickson;6.2;Short Comedy;Three men hammer on an anvil and pass a bottle of beer around A stationary camera looks at a large anvil with a blacksmith behind it and one on either side The smith in the middle draws a heated metal rod from the fire places it on the anvil and all three begin a rhythmic hammering After several blows the metal goes back in the fire One smith pulls out a bottle of beer and they each take a swig Then out comes the glowing metal and the hammering resumes
4;Corbett and Courtney Before the Kinetograph;1894;William_K.L._Dickson William_Heise;5.5;Short Sport;James J Corbett and Peter Courtney meet in a boxing exhibition James J Corbett and Peter Courtney meet in a boxing exhibition with special conditions that will allow the Thomas Edison Company to film the match and show it on their Kinetograph The match consists of six oneminute rounds The popular James J Corbett had earlier defeated the great John L Sullivan and must be considered a heavy favourite But at least for a while Peter Courtney seems to be holding his own
5;Edison Kinetoscopic Record of a Sneeze;1894;William_K.L._Dickson;5.6;Documentary Short;A man Thomas Edisons assistant takes a pinch of snuff and sneezes This is one of the earliest Thomas Edison films and was the first motion picture to be copyrighted in the United States A man Edisons assistant takes a pinch of snuff and sneezes This is one of the earliest Edison films and was the first motion picture to be copyrighted in the United States
6;Miss Jerry;1894;Alexander_Black;5.6;Romance;The adventures of a female reporter in the 1890s Geraldine Jerry Holbrook a girl of Eastern birth decides to start a career in journalism in the heart of New York after she feels that her father is close to a financial crush In the process she falls in love with the editor of her paper Mr Hamilton After the first successful article she leads Hamilton into doubting her love for him and this makes him accept a job in London But his worries prove wrong when Jerry accepts to marry him and leave to London
7;Exiting the Factory;1895;Louis_Lumière;6.9;Documentary Short;A man opens the big gates to the Lumière factory Through the gateway and a smaller doorway beside it workers are streaming out turning either left or right Most of them are women in long dresses and big hats but some are men Suddenly a man with a long apron rushes out through the crowd followed by a big dog At last some men on bikes leave the gateway When all workers have left the factory the doorkeeper starts closing the gates again
8;Akrobatisches Potpourri;1895;Max_Skladanowsky;5.4;Documentary Short;Eight circus performers known as the Grunato family perform their famous balancing act
9;The Arrival of a Train;1896;Auguste_Lumière Louis_Lumière;7.4;Documentary Short;A train arrives at La Ciotat station A group of people are standing in a straight line along the platform of a railway station waiting for a train which is seen coming at some distance When the train stops at the platform the line dissolves The doors of the railwaycars open and people on the platform help passengers to get off
10;The Photographical Congress Arrives in Lyon;1895;Louis_Lumière;5.8;Documentary Short;From a boat descend the photographers who must partecipate in the congress of Lyone dividing in two diagonals to the right and left After someone greets the film operator Members of the French Photographic Society arrive from a riverboat to their congress venue in NeuvillesurSaône on a summer day They go ashore across a wooden landing stage Among the many men in straw hats are also a few women in long skirts Some of the men lift their hats toward the photographer when passing Many of them are carrying their own cameras Down the gangway photographers leave the deck of a riverboat in large numbers In the background a bridge spans the river The group is in Neuville for a congress This film was shot in the morning The actors were the films audience that afternoon
11;The Sprinkler Sprinkled;1895;Louis_Lumière;7.2;Comedy Short;A gardener is watering his flowers when a mischievous boy sneaks up behind his back and puts a foot on the water hose The gardener is surprised and looks into the nozzle to find out why the water has stopped coming The boy lifts his foot from the hose whereby the water squirts up in the gardeners face The gardener chases the boy grips his ear and slaps him in his buttocks The boy runs away and the gardener continues his watering
12;Autour d'une cabine;1894;Émile_Reynaud;6.2;Animation Short;Precinematograph colour animation of a woman and man at the beach
13;Barque sortant du port;1895;Louis_Lumière;5.9;Documentary Short;A rowboat with three men is leaving a little harbor Two of them are rowing the boat while the third is sitting in the stern All of them wear hats They are passing the outer end of a pier where two women in long black gowns and aprons are standing together with two little girls Its windy and the waves are quite high When the boat passes the pier a big wave appears that almost throws the boat back into the harbor
14;Italienischer Bauerntanz;1895;Emil_Skladanowsky Max_Skladanowsky;4.8;Documentary Short;Two children Ploetz and Larella perform an Italian peasant dance
15;Das boxende Känguruh;1895;Max_Skladanowsky;5.5;Short;A man and a kangaroo stand up in front of each other with boxing gloves and simulate a boxing match on a theatre stage
16;The Clown Barber;1898;James_Williamson;6.6;Short Comedy;Clown cuts off customers head and replaces it
17;The Derby 1895;1895;Birt_Acres;5.1;Documentary Short Sport;A stationary camera looking diagonally across a racetrack toward the infield records the horses as they race past Once they are out of view and the race is over police officers run onto the infield The crowd moves around
18;Blacksmith Scene;1895;Louis_Lumière;5.2;Documentary Short;Two blacksmiths work while the vapors rise in the air Later another man arrives and offers a drink Two blacksmiths are at work facing the camera a wall window and stacked boxes behind them Both are mustachioed with dark hair On our right a smith in the dark clothes of a laborer continuously turns the handle of the bellows keeping hot a small furnace in front of him On our left in white shirt and tie the lead smith pounds a threefoot length of metal on an anvil and then plunges the shaft into a tub of water at his feet He takes a metal rod and scrapes it across the shaft Next from our left a man enters with refreshments Work pauses
19;The Sea;1895;Louis_Lumière;5.7;Documentary Short;Several little boys run along a pier then jump into the ocean The sea is before us Some rocks are visible to the right and a narrow jetty extends about ten meters or so about three feet above the sea held up by two sets of pylons A woman and several lads about ten years old are coming out onto the rocks one climbs onto the jetty at the end He jumps back into the sea as the lads and lady run out to the end of the jetty and jump off Even though the sea looks to be only about a foot deep one boy does a flip into the water and repeats it later The others simply jump in
20;The Oxford and Cambridge University Boat Race;1895;Birt_Acres;4.8;Short News Sport;Although the content of this film is primitive in the extreme  a shot of the traditional Oxford versus Cambridge University Boat Race filmed on March 30 1895  this film is of immense historical importance as being the first ever British filmMichael Brooke michaeleverymandemoncouk
21;The Messers. Lumière at Cards;1896;Louis_Lumière;5.7;Documentary Short;Two men play cards as a third watches and a waiter brings drinks The third man pours drinks as the waiter laughs Three men sit around a table at a terrace outside a bistro Two of them are playing cards while the third calls the waiter by knocking at the table The waiter arrives receives the order and is swiftly back carrying a tray with a bottle of wine and three glasses While the third man fills the glasses with wine the waiter follows the card game with great interest applauding and laughing loudly The three men raise their glasses and toast The two card players put more money on the table and continue their game Number 73 in the Lumière Brothers impressive film catalogue this original short movie depicting lively friends playing a game of cards was later remade by the great Georges Méliès in Une partie de cartes 1896 and then in a colourised version by the Lumières themselves in Partie de cartes 1897 Here three elegantlyattired gentlemen wearing fashionable shortbrimmed bowler hats sit around a wooden table at a sunny and flowerscented patio at La Ciotat as an enthusiastic waiter brings an effervescent beverage probably beer while playing cards On the left we see in his garden the father of Auguste and Louis Lumière Antoine in the middle Alphonse Winckler on the right Félicien Trewey and finally Antoines valet Antoine Féraud Two men are playing a friendly game of cards while a third man sits at the same table and watches them As the game proceeds a waiter brings a tray with a bottle and some glasses The spectator pours the drinks while the waiter turns his attention to the game which he finds quite entertaining
22;Cordeliers' Square in Lyon;1895;Louis_Lumière;5.6;Documentary Short;A stationary camera looks across the boulevard at a diagonal toward one corner of Lyons Cordeliers Square Its a long shot with a great deal of depth of focus We can see the sky and fronts of four buildings each four or five stories tall Its a busy thoroughfare with pedestrians walking in front of the buildings and crossing the boulevard between horsedrawn vehicles A doubledecker bus passes in front of us pulled by two horses Various tradesmen pass on wagons One van passes
23;Fishing for Goldfish;1895;Louis_Lumière;5.2;Documentary Short;A baby held by his father dips his little hands into a water jug and he can t catch the goldfish  A man holds a child of about 10 or 11 months so the child can stand on a table and look down into a large clear goldfish bowl nearly full of water with two goldfish swimming in it The child dressed in a white gown with a white cap makes an occasional grab for a fish The fish evade the child
24;Baby's Dinner;1895;Louis_Lumière;5.9;Documentary Short;As part of a maiden public film screening at the Salon Indien on December 28 in Paris Auguste Lumière pivots the centre of attention around his baby daughter as he tries to feed her from a spoon A baby is seated at a table between its cheerful parents Auguste and Marguerite Lumière While the father is feeding the baby with a spoon the mother is pouring coffee into her cup The father gives the baby a biscuit which the baby grabs but doesnt eat although both parents encourage it The father resumes feeding the baby with the spoon In their flowerscented spring garden in 1895 Auguste and Marguerite Lumière along with their baby daughter Andrée attempt probably the firstever homemovie as part of a maiden public film screening at the Salon Indien on December 28 in Paris Depicting a warm scene in the life of a family the patriarch Lumière pivots the centre of attention around his beautiful child as he tries to feed her from a spoon and then offers her a biscuit In the end as little Andrée looks straight into the camera she provides the viewers with an unexpected twist
25;Rough Sea at Dover;1895;Birt_Acres Robert_W._Paul;5.3;Documentary Short;The sea is quite rough and at Dover a series of heavy waves pounds against a pier and along the adjacent shoreline The scene then shifts to a different view of flowing water and shows a heavy current from a point along a riverbank The surf pounds against a breakwater on which are visible several people standing The wall looks to be about 20 feet above sea level and extend at least 100 feet into the water A large wave rolls picturesquely along the wall toward the shore Smaller waves follow Then the scene changes to river water flowing We see both shores in the foreground a log and tree branch are visible on the far shore there appears to be a low wall with trees beyond it The camera is stationary in both shots
26;Jumping the Blanket;1895;Louis_Lumière;5.6;Documentary Short;Outdoors with a nondescript building in the background four men stand each holding the corner of a blanket stretched parallel to the ground They wear the clothes of laborers By the back corner on our left stands a uniformed man who seems in charge A sixth man stands back from the blanket about six paces he runs forward and takes a leap but stops at the edge of the blanket and is upbraided by the uniformed gent The same thing happens a second time but the next three times he completes a flip landing on his back in the middle of the blanket and the four then boost him out toward the camera The final time seems like it will be his last for awhile
27;Die Serpentintänzerin;1895;Max_Skladanowsky;5.3;Short;A young woman dancer with large flowing robes swirls round herself quickly making her light robe flow around her like a butterflys wings
28;Trick Riding;1895;Louis_Lumière;5.6;Documentary Short Comedy;A man tries to get on a horse  but he climbs to one side and falls from the other until he manages to stay in balance In the background is a house In the foreground a groom holds the reins of a sleek black horse that stands in profile A tall man dressed in a black uniform demonstrates how to mount the horse then encourages and tries to assist a man in white The man in white keeps falling and soon its apparent that hes an putting on a show His pratfalls become more elaborate and stylish The horse stands patient The little groom laughs to see such sport And finally the man in white finds a comic accommodation The story though brief has a beginning middle and end
29;Arrivée d'un train gare de Vincennes;1896;Georges_Méliès;5.5;Documentary Short;This lost film presumably features a train arriving at Vincennes station
30;Watering the Flowers;1896;Georges_Méliès;5.8;Short Comedy;This lost film presumably features a person watering flowers to comedic effect This film is believed to have imitated the Louis and Auguste Lumière film Larroseur arrose which survives
31;Awakening of Rip;1896;William_K.L._Dickson;4.5;Drama Short;A series of short black and white films from director William KL Dickson which chronicle the adventures of Rip Van Winkle
32;Sea Bathing;1896;Georges_Méliès;4.8;Short;The film was shown tenth and completed the famous first paid Lumière cinema show of the ten films in Paris in the basement Grand Cafe on the Boulevard des Capucines 28 December 1895 Several little boys run along a pier then jump into the ocean Also known as A Dip in the Sea
33;The Ball Game;1898;William_Heise;4.3;Documentary Short Sport;The Readings Pennsylvania pitcher has just let a Newark New Jersey batsman walk to first Our camera is stationed about twenty feet from the bag and the satisfied grin of the runner is great as he touches first and gets up on his toes for second Next man cracks first ball pitched for a twobagger and races for the base with a wonderful burst of speed First baseman just misses a put out Very exciting Man on the coaching line yells and umpire runs up and makes decision Small boy runs past back of the catcher close to the grand stand where there is great commotion A most excellent subject treated brilliantlyEdison Catalo
34;Bataille de neige;1897;Louis_Lumière;6.7;Documentary Short Comedy Family;Wintertime in Lyon About a dozen people men and women are having a snowball fight in the middle of a treelined street The cyclist coming along the road becomes the target of opportunity He falls off his bicycle Hes not hurt but he rides back the way he came as the fight continues Uhoh He forgot his cap in the snow A bunch of adult men and women are having a snowball fight on a street each against all Some of the men wear hats all the women long skirts A man is coming on a bicycle straight into the crowd He is hit by several snowballs loses his balance and falls to the ground with his bicycle He lands on his back gets up struggles to reach his bike while the fight continues around him Another man rises the bicycle The biker turns it around mounts it and goes back the same way from which he arrived forgetting his cap on the ground The snowball fight continues
35;Batteuse à vapeur;1896;Georges_Méliès;4.7;Documentary Short;Little is known of this lost film presumably it featured one or more threshing machines
36;Le bivouac;1896;Georges_Méliès;4.8;Short;This lost film among the earliest by Georges Méliès presumably featured the use of a bivouac sack for a soldier encampment
37;Les blanchisseuses;1896;Georges_Méliès;4.9;Short;This lost film presumably features women washing clothing
38;"Boxing Match; or, Glove Contest";1896;Birt_Acres;5.8;Short Sport;Stage boxing match between SergeantInstructor Barrett and Sergeant Pope with a round interval and knockout
39;Bébé et fillettes;1896;Georges_Méliès;4.8;Documentary Short;Little is known about this lost film which presumably features young baby girls
40;The Bohemian Encampment;1896;Georges_Méliès;4.5;Documentary Short;Very little is known of this lost film according to the title it featured a gypsy camp
41;A Merry-Go-Round;1896;Georges_Méliès;5.8;Short;Very little is known of this lost Georges Melies film but the title indicates it may have featured children riding a merrygoround
42;Coronation of a Village Maiden;1896;Georges_Méliès;4.3;Short;Little is known about this lost film which presumably features a coronation of the rosary or a celebration of the Coronation of the Virgin Mary
43;Dancing Darkies;1896;William_K.L._Dickson;7.9;Documentary Short;A company of little darkies showing off their paces to the music of the banjoAMB Picture Catalogu
44;Danse serpentine;1896;Georges_Méliès;6.5;Short;This lost film is speculated to have featured a serpentine dance possibly in an imitation of the Edison Studios Annabelle films except with a different dancer
45;Dessinateur express;1896;Georges_Méliès;4.4;Short;This lost film featured a talented sketch artist drawing the statesman and historian Adolphe Thiers with stunning rapidity
46;Dessinateur: Chamberlain;1896;Georges_Méliès;4.1;Short;This lost film featured a talented sketch artist drawing the statesman and Liberal Unionist Joseph Chamberlain with stunning rapidity
47;Dessinateur: Reine Victoria;1896;Georges_Méliès;4.3;Short;This lost film featured a talented sketch artist drawing Her Majesty H M Queen Victoria with stunning rapidity
48;Dessinateur: Von Bismark;1896;Georges_Méliès;4.4;Short;This lost film featured a talented sketch artist drawing the Prussian statesman Otto Von Bismark with stunning rapidity
49;Post No Bills;1896;Georges_Méliès;4.9;Short;Two bill posters argue as an incompetent guard patrols the area Listed as number 15 in the Star Films catalogue Post No Bills is one of Georges Méliès earliest works which was presumed lost Minimalistic and devoid of the usual special effects which made famous the French illusionist and pioneering filmmaker this is indeed a rather simple story however what it lacks in innovation it makes up for humour and irony Exactly 125km outside of the bustling city of Paris a notsovigilant sentry is assigned the relatively easy task of guarding a blank white wall where postering is strictly forbidden But when the guard marches past the partition an audacious bill poster plasters the surface with an advertisementand moments lateranother bold worker pastes up yet another poster Before long a great advertisement war breaks out behind the sentrys back Is the officer of the law inept or is he plainly apatheticNick Rigana
50;Démolition d'un mur;1896;Louis_Lumière;6.4;Documentary Short;Auguste Lumière directs four workers in the demolition of an old wall at the Lumière factory One worker is pressing the wall inwards with a jackscrew while another is pushing it with a pick When the wall hits the ground a cloud of white dust whirls up Three workers continue the demolition of the wall with picks
51;Sea Breaking on the Rocks;1896;Georges_Méliès;4.7;Documentary Short;Very little is known about this lost film but according to the title it possibly featured large waves crashing against jagged black rocks on a coast
52;The Conjuring of a Woman at the House of Robert Houdin;1896;Georges_Méliès;6.4;Short Horror;As an elegant maestro of mirage and delusion drapes his beautiful female assistant with a gauzy textile much to our amazement the lady vanishes into thin air An elegantly dressed man enters through a stage door onto a set with decorated back screen a chair and small table He brings a welldressed women through the door spreads a newspaper on the floor and places the chair on it She sits and fans herself he covers her with a diaphanous cloth She disappears he tries to conjure her back with incomplete results Can he go beyond the bare bones of a conjuring trick and succeed in the complete reconstitution of a the ladyjhaileyhotmailcom Dressed in an immaculate and elegant evening attire a maestro of mirage and delusion walks onto the theatre stage accompanied by his faithful female assistant As he places an ordinary sheet of newspaper on the floor the illusionist drapes his beautiful helper with a gauzy textile and much to our amazement the lady vanishes into thin air Will he summon her up in one pieceNick Rigana A stage magician dressed in a tux enters the stage of his theater and bows to the audience before introducing his attractive female assistant He stands her to one side while placing a newspaper on the floor of the stage in order to indicate lack of trapdoor The woman is now seated in the chair As she fans herself he places a blanket over her disclosing her from sight and upon lifting it up reveals she has vanished into thin air The magician summoning up his powers now produces a skeleton in the chair Finally covering the bony figure with the blanket once more he takes it away and the woman is revealed to be sitting in the chair again unharmed She and the magician bow before entering again for a curtain call
53;Exit of Rip and the Dwarf;1896;William_K.L._Dickson;4.5;Drama Short;A series of short black and white films from director William KL Dickson which chronicle the adventures of Rip Van Winkle
54;Feira de Gado na Corujeira;1896;Aurélio_da_Paz_dos_Reis;4.5;Documentary Short;Campinos on horseback drive small herds of cattle through the vast area of the traditional fair before prospective buyers
55;A Hard Wash;1896;William_K.L._Dickson;5.4;Comedy Short;A colored woman washing a little pickaninny Very funny and especially pleasing to childrenAMB Picture Catalogu
56;Gardener Burning Weeds;1896;Georges_Méliès;5.3;Short;Little is known about this lost film which presumably features a gardener
57;Leaving Jerusalem by Railway;1897;Auguste_Lumière Alexandre_Promio;6.3;Documentary Short;A train is leaving a railway station at the outskirts of Jerusalem From the very end of the train a barren rocky landscape is seen and some ruins of very old buildings Five men walk along the track tipping their hats when the train departs When it approaches the station building more people are seen people of different ethnicity and religion Some men wear fezzes on their heads and canes in their hands A Franciscan monk comes walking in the middle of a mixed group of people The platform outside the station is crowded with people waiting for the next train Among them is a man with a sword at his side The big windows of the station are covered with shutters After the station the train passes a long fence enclosing a lumberyard
58;The House of the Devil;1896;Georges_Méliès;6.7;Short Horror;With the help of a magic cauldron Mephistopheles conjures up a variety of supernatural characters A bat flies into an ancient castle and transforms itself into Mephistopheles himself Producing a cauldron Mephistopheles conjures up a young girl and various supernatural creatures one of which brandishes a crucifix in an effort to force the devilvampire to vanish As a ferocious large bat enters a daunting medieval manor the prince of darkness assumes his true form and without delay he produces a black ritual cauldron Before long two weary cavaliers who will inadvertently take part in the dark ceremony will witness firsthand the otherworldly horrors spawned on earth Who has the heart to oppose the archfiends evil trickeryNick Rigana
59;Place de l'Opéra, First View;1896;Georges_Méliès;5.5;Documentary Short;This lost film presumably features the Place de lOpéra in Paris France
60;Place du théâtre français;1896;Georges_Méliès;5.3;Documentary Short;This lost film presumably shows the Place du ThéâtreFrançais
