;title;year;directors;rating;genres;plot
172;Kit Carson;1903;Wallace McCutcheon;5.7;Short Western;"Kit Carson is captured by Indians and tied to a tree in the Indian village. An Indian maiden helps him make his escape.::Anonymous This subject is a production upon which was spent a great deal of time and money. It was taken amid scenery of the wildest natural beauty and enacted with the greatest possible fidelity to the original. The costumes, arms, log cabins, etc., are all historically correct. The story embodies the adventures of the greatest of all the American scouts and pathfinders, ""Kit Carson,"" his life in the wilderness, his hand-to-hand conflicts with the savage Indians, his hairbreadth escapes and his safe return to his log cabin home in the clearing. The subject is absolutely a novelty in moving pictures. 1. MORNING IN THE WILDERNESS. As the dawn breaks, Kit Carson and his fellow trapper are seen awakening from their pine bough couches. They wash at the brook, start a fire and prepare their frugal meal. This finished, they remove all trace of the fire, arrange their packs, take their rifles and start off into the depths of the forest. 2. INDIANS FIND THE TRAIL. The same scene. The trappers have departed and a band of painted Indians appear. They discover the trail of the trappers, and after a brief conference start out after them. 3 IN CAMP FOR THE NIGHT. Here we seee Kit Carson and his companion, fatigued by the weary tramp of the day, locating their camp by the side of another stream. The evening meal is cooked and the trappers lie down to sleep. 4. THE NIGHT ATTACK. While Kit and his companion are asleep, the Indians make their treacherous attack. The fight is short and bloody. Three of the savages are laid low, but Kit's companion is killed and Kit himself after a terrific struggle, is taken captive and bound. 5. OVER THE LOG. Here we see the exultant savages and their captive threading their way through the dense growth of the forest. They come to a stream which is spanned by a large birch log. Over this the Indians pass in single file, followed by Kit, his arms bound but all senses alert. One buck brings up the rear. As Kit reaches the center of the log, he engages the attention of the buck for an instant, then quick as a flash topples him into the water, and springing into the water on the opposite side, Kit is lost to view. The other Indians come running back and plunge through the water in their eager search for Kit. 6. THE CANOE CHASE. A wild river. On either side immense pine trees. Around a distant turn Kit is seen coming in his canoe, paddling for dear life. He is followed by three other canoes, filled with Indians, all paddling desperately. Kit fires at the foremost canoe and all disappear around another bend of the river. 7. ARRIVAL OF THE INDIAN SCOUT. Farther down the river an Indian scout is seen rapidly approaching in his canoe. He runs his frail craft ashore and tells his companions of the coming of Kit. 8. ATTACK ON CANOE AND SECOND CAPTURE OF KIT. The Indians who have been warned in the preceding scene hide in ambush. Kit comes along in his canoe unconscious of this new danger. As he comes opposite the ambush, the savages, naked save for their breech-clothes, jump into the water, overturn the canoe, and after another thrilling conflict the intrepid Kit is again a prisoner. 9. IN THE INDIAN CAMP. This is a remarkable scene. Here we have the Indian village, with its skin-covered tepees. Squaws and their papooses, young bucks and Indian maidens are seen at their various occupations. Here we have real Indian life. Kit is brought into camp by his captors and his advent creates great excitement. He is tied to a tree and subjected to various tortures and indignities, which he bears with undaunted mein. Even when tomahawks are hurled at his head he does not falter. Night comes, and the life of the village is stilted. Kit is guarded by one brave, who sleeps on his rifle by the fire. Death seems very near, but help is near at hand. An Indian maiden, moved to compassion by his condition, severs his bonds and once again Kit is free. 10. THE HOME IN THE WILDERNESS. Here we see Kit's rude log cabin in the clearing. His wife and children are busy with household affairs and eagerly watching for the return of the father. A little girl runs in with the glad news, and soon Kit stalks in and is quickly overwhelmed by the loving embraces of his wife and children.::Biograph Bulletin"
173;Life of an American Fireman;1903;George S. Fleming Edwin S. Porter;6.4;Short Action;"A fireman rushes into a carriage to rescue a woman from a house fire. Breaks the window glasses and he goes down with the woman. After dangerous and uncertain moments, the fireman save the woman' s son, too.::luigicavaliere Porter's sequential continuity editing links several shots to form a narrative of firemen responding to a house fire. They leave the station with their horse drawn pumper, arrive on the scene, and effect the safe rescue of a woman from the burning house. But wait, she tells them of her child yet asleep in the burning bedroom . . .::Thomas McWilliams <tgm@netcom.com> It would be difficult for the exhibitor to conceive the amount of work involved and the number of rehearsals necessary to produce a film of this description. We were compelled to enlist the services of the fire departments of four different cities, New York, Newark, Orange, and East Orange, N. J., and about 300 firemen appear in the various scenes. From the first conception of this wonderful series of pictures it was our aim to portray the ""Life of an American Fireman"" without exaggeration, and at the same time to embody the dramatic situations and spectacular effects which so greatly enhance a motion picture performance. The work of American fire departments is known throughout the world, and the fame of the American fireman is echoed around the entire world. He is known to be the most expert, as well as the bravest, of all fire fighters. This film faithfully and accurately depicts his thrilling and dangerous calling and emphasizes the perils he encounters when human life is at stake, every movement of the brave firemen and their perfectly trained horses from the moment the men leap from their beds in response to an alarm until the fire is extinguished and a woman and child are rescued after many fierce battles with flame and smoke.::Edison Catalog"
174;Mary Jane's Mishap;1903;George Albert Smith;6.7;Short Comedy;Smith casts his wife as a sluttish housewife who is mutilated by lighting her oven with paraffin.::Scott Hutchins <sahutchi@cord.iupui.edu> The merry housewife, Mary Jane, starts her day early in the morning by doing her myriad domestic chores. After using pitch-black boot polish as a makeshift make-up, the reckless servant sets her mind on starting a fire--and when all else fails--Mary grabs a paraffin can, pours liberally on the seemingly extinguished fire, and out the chimney she goes. Will her untimely demise be a warning to all kerosene lovers?::Nick Riganas Mary Jane tries to light the oven. When she's unsuccessful, she plays around, getting black boot polish on her face. She mugs before a mirror. Then, it's back to work. When the stove still won't light, she pours in paraffin, winks at the camera, and lights a match. Kaboom! Is there any rest for the foolish, even in the grave?::<jhailey@hotmail.com> Mary Jane is a typical 'Hinglish girl. She is seen in her kitchen, having overslept herself, skurrying about, trying to do a number of things at one time. She blackens the Master's boots, puts the kettle on, builds the fire, etc., etc. While engaged in shoe-blacking, she scratches her nose with the blacking brush and leaves a large black mark on her face which makes it appear that Mary Jane has a mustache. However, she goes on with her work, but the fire will not come up. Mary runs for the paraffin can, and proceeds to pour about a quart of the fluid on the apparently extinguished fire, after which she kneels on the floor to blow some life into the old kitchen range. She evidently succeeds for, suddenly an awful explosion occurs and Mary is seen traveling heavenward. The picture changes to an exterior view. The housetops continue her flight toward angel land. Shortly after, she descends piecemeal and when the last piece has fallen the picture dissolves into a scene laid in a graveyard where poor Mary was interred. The inscription on the tombstone is to effect that Mary had gone to heaven by the aid of paraffin. An old lady accompanied by three younger ones visits the grave but are fightened off by the ghost of the departed kitchen maid who is seen in ghostly form tightly hugging the paraffin can. Exceedingly fine.::Lubin Catalog
175;The Messenger Boy's Mistake;1903;Edwin S. Porter;4.7;Short Comedy Romance;"""Cholly"" wishes to call on his best girl and sends her a large bouquet. To find out if the girl really loves him, he sends a note with the messenger boy requesting her to ""wear this"" if she does. The boy delivers the note and a package which the young lady opens and finds an old pair of trousers and other masculine wearing apparel. She becomes enraged. When ""Cholly"" comes she proceeds to give him instructions as to what to do in the future, etc., but before she finishes, the boy, having discovered his mistake, returns with the right box. ""Cholly"" hastily closes up the wrong one, hands it to the boy and kicks him out of the door. He then opens the right box and presents the bouquet himself. She wears the flowers, and things are now all right.::Edison Catalog"
176;The Music Lover;1903;Georges Méliès;6.9;Short Comedy Music;"The leader of a marching band demonstrates an unusual way of writing music.::Snow Leopard Under a set of five telegraph lines, a bandmaster and his marching band of talented female vocalists prepare to sing. But first, the leader needs to arrange the notes and place the G-clef on the lines. There he goes. Now, everything is ready for an unforgettable performance.::Nick Riganas A marching band appears, and the band-leader prepares to give them the music for the song he wants them to play. He has prepared a large staff above their heads, and he now creates notes by making duplicates of his own head, placing them on the staff, and completing the notes with sticks and other implements taken from the band members. When he has finished, the players attempt to perform the music that has been written in such an unusual fashion.::Snow Leopard A singing teacher, followed by his pupils, meet in the fields some telegraph wires strung on poles. These wires, the professor thinks, would form a very effective musical staff. He carries an enormous key of G which he throws upon the wires to give the proper pitch to his pupils. He forms a measure by fixing his cane in a perpendicular position among the wires which run in parallel direction, thus forming the lines of a staff of music. In order to have notes, he tears off his own head and fixes it among the wires. Thus he obtained the first note of his air. Then he fixes upon this staff several heads corresponding in position to the first part of the tune, ""God Save the King."" One hears the beating of drums, the heads rearrange themselves and one sees the second line of the air. Another beating of drums, and the heads shift about until they form the third line of music. Satisfied, the professor departs, followed by his pupils. The heads, abandoned among the wires, cast a look at the crowd as it disappears. Immediately they are changed to birds and fly away. This subject, accompanied by the proper music, produces great laughter.::Lubin Catalog"
177;Rip Van Winkle;1903;William K.L. Dickson;4.8;Short Comedy;An abridged version of the tale of Rip Van Winkle, a lazy American man, who wanders off one day with his dog Wolf into the Kaatskill mountains where he runs into an odd group of men drinking and playing bowls. He drinks some of their mysterious brew and passes out. When he wakes up under a tree he is astonished to find that 20 years have passed and things are a lot different. This is a charming story about how America changed due to the Revolutionary War, only in a different and more subtle way than ever told before.::Shane Rothery
178;"Fairyland; or, the Kingdom of the Fairies";1903;Georges Méliès;7.4;Short Adventure Fantasy;"In this spectacular free adaptation of the popular theatre play ""La Biche au Bois"", the valiant Prince Bel-Azor pursues a baleful old witch to her impregnable castle, to save the beautiful young Princess Azurine.::Nick Riganas In this spectacular, meticulously hand-coloured movie which incorporates a plethora of never-seen-before special effects, interchanging panoramas and soft dissolves, the indefatigable director Georges Méliès presents a free adaptation of the popular theatre play ""La Biche au Bois"" by the brothers Cogniard. Following the announcement of the espousal of the beautiful young Princess Azurine and the noble Prince Bel-Azor, a baleful old witch casts a fiery and sulphurous curse on the innocent woman, and then aided by her evil minions, captures her and takes off on a blazing gilded chariot. But the valiant Prince along with the Fairy Godmother, Aurora, pursue the sorceress, from the unfathomable chasms of the eternal sea to great Neptune's realm, and finally, the abominable witch's impregnable castle. Who shall stand in the way of love?::Nick Riganas At the royal court, a prince is presenting the princess whom he is pledged to marry, when a witch suddenly appears. Though driven off, the witch soon returns, summons some of her servants, and carries off the princess. A rescue party is quickly organized, but the unfortunate captive has been taken to a strange, forbidding realm, from where it will be impossible to rescue her without some special help.::Snow Leopard Tableau 1. The Betrothal of the Prince. 2. The Gifts of the Fairies. 3. The Curse of the Jilted Damsel. 4. The Boudoir of the Princess. 5. Abduction of the Princess by the Demons --The Chariot of Fire. 6. The Top of the Tower --The Castle in Alarm. 7. Flight Through the Skies in the Chariot of Fire. 8. The Armory of the Castle. 9. The Vision in the Haunted Chamber. 10. The Genius Bestows Upon the Prince the Armor. 11. The Impenetrable Armor --The Prince Knighted. 12. Embarkation on the Royal Galley. 13. Encountering a Tempest at Sea. (New Effects.) Thunder and Lightning and Torrents of Rain. The Horizon overcast by Angry Clouds. The Heaving Seas, Mountainous Waves and Rain produced by Real Water. 14. The Ship Wrecked on the Rocks. 15. Sinking to the Ocean Bed. (Real Fishes and Sea Monsters.) 16. The Prince Rescued by the Mermaid Queen. 17. The Submarine Caves --Encounter with a Cuttle-Fish. 18. Review of the Habitues of the Deep. --Father Neptune's Car. 19. The Palace of the Lobsters. 20. The Azure Grotto. --The Flowers of the Sea. 21. In Neptune's Empire. --Great Submarine Spectacle. 22. The Whale. --The ""Omnibus of the Deep."" 23. On Land Once More. --The Entrance to the Cave. 24. The Cavern of the Spirits. --Encounter with Pre-historic Monsters and a Gigantic Boa. 25. Sleep Overcomes the Luckless Voyagers. --The Mountain Torrent and Falls. (Real Water with dissolving effects.) 26. The Palace of Boots. --Dance of the Boots. 27. Escape from the Cavern. --On the Edge of the Precipice. 28. The Plunge of a Hundred Yards. 29. The Castle of the Devil. --The Witch in League. 30. The Castle on Fire. --Rescue of the Princess. (New magnificent fire effects and sensational change of scene in full view.) 31. The Death of the Witch. --Enclosed in a Cask and cast from the Cliffs into the Sea. 32. The Terrors of the Gulf. 33. The Palace of the King. --The Wedding Procession. 34. The Queen of the Air in Her Domain. 35. Apotheosis. --In the Kingdom of Fairyland.::Lubin Catalog"
179;The Sick Kitten;1903;George Albert Smith;5.9;Short Comedy Family;A girl gives a spoonful of medicine to a kitten.::British Film Catalogue A simple scene of two rather flamboyantly-dressed Edwardian children attempting to feed a spoonful of medicine to a sick kitten. The film is important for being one of the earliest films to cut to a close-up, then back again to the same medium shot as before::Michael Brooke <michael@everyman.demon.co.uk>
180;Uncle Tom's Cabin;1903;Edwin S. Porter;5.2;Short Drama;Based on the novel by Harriet Beecher Stowe: Eliza, a slave who has a young child, pleads with Tom, another slave, to escape with her. Tom does not leave, but Eliza flees with her child. After getting some help to escape the slave traders who are looking for her, she then must try to cross the icy Ohio River if she wants to be free. Meanwhile, Tom is sold from one master to another, and his fortunes vary widely.::Snow Leopard
181;Rum vs. Cherries;1904;Robert W. Paul;5.4;Short Drama;A barmaid plies a swell with smiles and with cherries from a box that's just been delivered. When she refuses a cherry to a roughly-dressed tradesman who runs a tab at the bar, he pays off his debt in a huff, using all his week's pay. He then storms penniless and without provisions into his ill-furnished house where his wife and two children, ill-clad and ill-fed, cower. Is there any hope for him and for his family? If he does realize how low he's sunk, what help is there to lift him up? Will the family ever know the taste of cherries?::<jhailey@hotmail.com>
182;The Enchanted Trunk;1904;Georges Méliès;5.0;Short Fantasy;A medieval magician performs a magic show involving a long ornate trunk in which he makes his assistants appear, disappear, and transform into other people.::Tornado_Sam
183;The Great Train Robbery;1903;Siegmund Lubin;7.1;Short Western;The first scene shows the chief as he explains to his followers the plan of the great train robbery. Two masked robbers enter and compel the operator to stop the approaching train. They make him write an order to the engineer to take water at this station instead of at the regular watering stop. The train stops, the conductor comes to the office window, where the operator delivers the order while the bandits keep their revolvers trained on him. No sooner has the conductor left when they bind and gag the operator, and hastily depart to catch the moving train. This scene shows the train at the water tank. The bandits are hiding behind the tank, and just before the train pulls out they quickly board the express car wherein the messenger is busily engaged with his duties. Alarmed by the unusual sound, the messenger unlocks the door, peeps through the keyhole, discovers the bandits and quickly locks the iron boxes which contain the valuables. He then throws the key through small window and pulls out his revolver to defend the valuables entrusted to him. Two robbers succeed in entering the car. The messenger bravely attacks them and discharges his revolver, but he is quickly laid low by a bullet. The bandits bind and gag him and then try to open the treasure box. When they find it locked they search the messenger for the key, and as they do not find it, they blow up the strong box with dynamite. They take the valuables and the mail bags and quickly leave the car. During all this time the train is seen flying past beautiful scenery. While two of the robbers blow up the strong box in the express car, two other ones hold the engineer and the fireman at pistols' point. The fireman takes a coal shovel and climbs up on the tender to defend himself and his position, but he soon finds himself overpowered and thrown from the swiftly moving train. The two bandits then compel the engineer to stop the train. Forced by the robbers, the engineer brings the train to a stop, uncouples the engine and pulls ahead about two hundred feet, always covered by the bandits' pistols. In the meantime two of the bandits compel the passengers to leave the coaches with hands up. They line them up along the tracks, go through their pockets and relieve them of all their valuables. One passenger makes an attempt to escape, but is instantly shot down by one of the bandits. As soon as they have all the booty the bandits mount the engine and make good their escape, while the passengers lend their helping hand to their unfortunate friend who is badly wounded by one of the bandits. The bandits bring all the booty on the locomotive and command the engineer to pull the lever and pretty soon we see them disappear in the distance. Far out in the rough countries the bandits command the engineer to stop, descend from the engine, and escape to the mountains with the stolen goods. This scene shows the bandits coming down from the mountains into the valley, where they cross a stream to get to a place of safety. The scenery is truly beautiful. One of the robbers, in his hurry, slips and falls in the water, but he quickly rises and makes good his escape. This scene brings us back to the interior of the telegraph office, where the operator lies bound and gagged on the floor. After a desperate struggle he succeeds in reaching the table where his instruments stand. He telegraphs for help and manipulates the key with his mouth, and then falls to the floor, fainting from exhaustion. The operator's little daughter enters to bring him his daily dinner. She finds her father bound, kneels down, praying to the Lord to give her strength to help her poor father, throws a glass of water in his face, restoring him to consciousness, takes a knife and cuts the ropes and removes the gag from his mouth. This typical Western dance hall shows some men in company with women. A tenderfoot appears upon the scene and is made to dance in the regular Western style. Suddenly the door opens, the operator's little daughter enters and relates what has happened. The men quickly stop their merriment, take their guns and leave in pursuit of the outlaws. The bandits are seen dashing through the woods on spirited horses followed closely by the Sheriff and a large posse. One of the bandits is shot and falls from his horse, but he staggers to his feet again and kills one of the Deputy Sheriffs before he expires. This scene shows the bandits in a fierce fight with the Sheriff's posse. The bandits dismount their horses, and, not thinking that the Sheriff and his Deputy were so near, are just beginning to look over their booty when suddenly the Sheriff and his Deputies appear on the scene. A desperate battle takes place, and, after a brave stand the bandits and several of the pursuers breathe their last. This scene shows a life-size picture of Daniels, the chief of the bandits, as he takes aim and fires into the audience. The picture is so realistic that women scream, and even though no sound is heard, they put their fingers in their ears to shut out the noise of the firing.::Lubin Catalog
184;The Land Beyond the Sunset;1912;Harold M. Shaw;7.0;Short Drama Fantasy;"A young boy, opressed by his mother, goes on an outing in the country with a social welfare group where he dares to dream of a land where the cares of his ordinary life fade.::Maestro-1 Thanks to the Fresh Air Fund, a slum child escapes his drunken mother for a day's outing in the country. Upon arriving, he and the other children are told a story about a mythical land of no pain. Rather then return to the slum at day's end, the lad seeks to journey to that beautiful land beyond the sunset.::Thomas McWilliams <tgm@netcom.com> Little Joe's grandmother, a drunken old hag, beats and abuses him when he fails to bring her sufficient money with which to replenish her supply of liquor. A settlement worker has given Joe a free ticket to a seaside excursion and picnic given by the Fresh Air Fund. What a day it was. Joe actually walked upon the grass without being driven off. He romped and played with the hundred other waifs until they were called to lunch. And then the fairy story, the first he had ever heard. The soft voice of his pretty chaperon added greatly to the story and Joe's imagination began to work. But alas. The setting sun proclaimed it time to return to the city; the glorious day was at an end but not for little Joe. His chaperon had laid the book down at his very feet and now bustled about getting her charges ready for departure. Joe picked it up; the story all came back. He walked along the beach toward the setting sun. He found a boat without oars and not a soul in sight. A look at the book and the thought of his hovel called ""home"" helped him to make up his mind. His fairies had guided him to the shore and sent him a boat into which he climbed; he needed no oars because his fairy friends guided the boat and so he sailed out to sea, along the path of shining light to the land beyond the sunset.::Moving Picture World synopsis"
185;Personal;1904;Wallace McCutcheon;5.0;Comedy Short;A man who has placed a personal advertisement for a prospective wife goes to wait at the meeting place that he designated. Soon a woman comes in response to the advertisement. Before the two have a chance to converse, several more women arrive on the scene. Now completely flustered, the man flees, initiating a lengthy chase.::Snow Leopard
186;The Pearl Fisher;1907;Ferdinand Zecca;6.1;Short Fantasy;Captivated by a vision of beckoning women, a man dives into the ocean, and soon finds himself walking on the ocean floor. After encountering numerous sea creatures, he comes to a giant oyster. When the oyster is opened, a strange adventure begins for the diver.::Snow Leopard
