;title;year;directors;rating;genres;plot
335;A Fool's Revenge;1909;D.W. Griffith;5.4;Short Drama;A court fool believes the Duke is after his beautiful daughter, and arranges to have the Duke murdered. The daughter overhears the plot and, disguised in the Duke's cloak, sacrifices her life to save him.::Anonymous A free adaptation of the story of Rigoletto. The Biograph here holds up to your pity a court-fool, whose inordinate love for his child prompted him to plan vengeance which reverted upon himself. The Duke suffers from melancholia and his courtiers are at wits' end to dissipate his ennui. Diversion of all sorts are brought, but without success, until at last they decide to abduct the pretty daughter of the fool and bring her to the Duke. This is effected, and when the Duke sees her he falls deeply in love with her, but her pure innocence instills in him a higher, holier devotion than he was accustomed to experience, so he harkens to her plea, and throwing his cloak about her, sees her safely home. This is witnessed by the fool, who is in hiding, and misjudging the Duke's attitude, vows vengeance. To this end he enlists the services of a nomad couple who are dwelling in a hut not far off. He bargains with them that to kill the man he shall point out he will pay them five hundred louis. The pact is made, and the Duke is pointed out to them by the fool as he strolls in the gardens with the girl. As the Duke leaves the girl she espies the trio skulking on the grounds and follows them to the hut, where she overhears the plan. She at once decides to save the Duke, but how? To tell him would incriminate her old father. Nothing seems feasible but self-sacrifice, which she bravely determines to do. Going to her house, she dons male attire and with the cloak the Duke had loaned her thrown over her shoulders she bids adieu to her home and life and like a soldier goes bravely unto death. Entering the hut, her face hidden, she receives the blow intended for another and dies before the horror-stricken gypsy couple, who discover their mistake. They, however, put her body in a sack, and when the fool appears, collect their promised fee and flee. The fool is now in a state of fiendish exultation over the seeming success of his vengeance, and after dancing gleefully around the sack, determines to make away with it, but upon picking it up is startled by the litheness of the form enclosed. Ripping open the sack, the sight that greets him fairly freezes his blood, for there lies his own daughter, cold in death, a victim of his own dastardly plot. This final scene is without doubt the most intense bit of work ever done in motion pictures.::Moving Picture World synopsis
336;Fools of Fate;1909;D.W. Griffith;5.7;Short Drama;"Fanny is the wife of Ben Webster, a trapper, and while he is an affectionate and dutiful husband, she yearns for something which appears better than her lot. She reasons: ""Have I not youth and beauty and attainments far above this environment? Why should I be compelled to toil and struggle in this wilderness?"" Truly, she did not know just what she yearned for, still a change of any sort would have been acceptable. Discontent is stamped upon her countenance, as Ben bids her good bye for a hunting trip in the North Woods. Webster embarks in his canoe, and sighting game, stands to fire. The light craft is overturned, throwing him into the water. Weighted down by his heavy clothing and cartridge belt, he would have drowned had not his plight been witnessed from the shore by Ed Hilton, a Canadian hunter. Hilton leaps in and succeeds in dragging the half-drowned trapper to land, where a strong friendship springs up between the two, and as night falls they make camp and sleep under the same blanket. Next morning they part with a vow of eternal friendship. Fanny goes to the village grocery store, and by chance meets Hilton, and it is a case of love at first sight with both, each, of course, ignorant of the other's identity. A second meeting is contrived and Hilton, thinking her a single girl, suggests an elopement, to which she consents. A meeting place is planned, and Fanny is there and leaves with Hilton his cabin. She has, however, left a note for Ben saying that she ""is tired, and is going away."" Poor Webster's heart nearly breaks as he reads this short, but cutting letter. Grief at first possesses him, then revenge. Taking up his gun, he starts after her. He hits a trail with the aid of a couple of villagers who had witnessed unseen the clandestine meeting of Fanny and the Canadian. Tracking them to the cabin he bursts in a few moments after their arrival. You may imagine the amazement on both sides when Ben finds Hilton is the man, and Hilton learns that Webster's wife is the woman. Hilton proves his innocence by commanding Webster to shoot; but no, Ben cannot kill the man to whom he owes his life, and so he staggers out and hack to his own home. Hilton, on the other hand, drives the heartless Fanny from him. She goes out, and for a time is undecided, when she resolves to face her husband and beg his forgiveness. Night has fallen and the cabin is in darkness when she enters. Going to the next room she gets the lantern, by which light she sees her husband sitting with his head reclining on the table. She assumes it is his grief, but on touching him, his inert form falls to the floor, he has terminated his existence. The shock causes her to recoil, and so doing knocks over the lantern, extinguishing the light. There in the shaft of moonlight we leave her kneeling beside the awful result of her discontent. ""Oh, thou fool!""::Moving Picture World synopsis On a lake in the woods, a man's boat suddenly capsizes. He nearly drowns, but another man camping nearby sees him and rescues him. After they part, the rescuer meets the first man's wife and, not knowing who she is, he befriends her and begins to spend time with her. It is not long before a tense and very uncomfortable situation develops.::Snow Leopard"
337;The French Duel;1909;D.W. Griffith;5.1;Short Comedy;"Alphonse and Gaston get into an argument over cocktails and agree to a duel.::Anonymous Extreme tranquility hovered over the Salon Litteraire of the Club Montmartre, and the members seemed to be in a state of ennui, the silence being broken only by the ticking of that horometrical instrument, the clock. when Mons. Leon Martinel enters in company with Mons. Gaston Tortoni, whom be introduces to Mons. Alphonse de Signoles. Alphonse orders le garçon bring a round of cocktails, and he puts an olive in each. This Tortoni objects to, but Alphonse insists, ""Oui! Oui!"" Tortoni then with thumb and forefinger extracts the olive from the cocktail, and hurls it, yes hurls it in the face of Alphonse. Consternation! The members stand aghast until Alphonse retaliates in like manner. Amazement! The feud is on, honor must be satisfied; a duel is inevitable, and speculation keen, as Alphonse is in the bantam class, while Tortoni is a replica of the Eiffel Tower. On the field of honor, beside the ruins of the old Conciergerie, they meet. A corps of trained nurses, doctors and undertakers arrive, and the seconds prepare the weapons, while the undertakers measure the contestants for their prospective receptacles. Muskets are first selected, but one of them accidentally discharges and throws the party into hysterics, so they are discarded. Rapiers are finally resorted to and a most furious combat is precipitated, which would have resulted fatally for Tortoni had he not had a tin tray concealed beneath his vest as a shield, and so the duel finishes to the entire satisfaction of everybody but the undertakers.::Moving Picture World synopsis"
338;The Friend of the Family;1909;D.W. Griffith;4.7;Short Drama;"Robert is about to abandon his family for a society beauty. His best friend romances the beauty, who then drops Robert and sends him back to his family.::Anonymous The most colossal egotist is he who boasts of his impregnability of the fascination of a pretty woman, for the most austere wiseacre will become a doting fool under her puissant influence, so we do not marvel at the action of Robert Edmonds in falling a victim to the ensnaring charms of Estelle Morse during a house party at his residence. From that evening on he becomes her abject slave to the neglect of his own devoted wife and child. Mrs. Edmonds tries hard to dissemble and keep her sorrow from the little one, but he too misses the society of papa, his little romps with him and his good-night kiss on going to bed, until at last he is constrained to write papa a note complaining of his neglect. The baby's innocent missive almost breaks mamma's heart, for she feels that her husband is being weaned away by some unknown power. Robert is simply oblivious to all sense of duty through this blinding fascination and would have cast aside wife, child and all things sacred for this woman, had not Jack Hudson, his dearest friend, stepped in and resolved to save him at all hazards. Jack learns of Robert's intention to elope with the other woman, and calls on her just after Robert has gone to get his suitcase preparatory to depart. Jack steps boldly into the affair and during Robert's absence becomes so ardently caressing in speech and action that she, the most fickle of her sex, forgets Robert and is now Jack's apparent affianced.. At this moment Robert returns ready for flight; but at once realizes the change. Crestfallen he returns home where he finds baby's letter on the table. The child's tearful, mute appeal awakens him from his lethargy and we leave him with the little fellow clasped to his breast, while the mother, unseen by him, views the spectacle from the staircase. This Biograph subject is an extremely beautiful work of dramatic and photographic art.::Moving Picture World synopsis"
339;Getting Even;1909;D.W. Griffith;5.1;Comedy Short;"The most satisfying and pleasurable sensation experienced is ""getting even,"" especially where one has been held up to ridicule before a jeering mob. Such was the reguerdon of Bud, the Kid of the Mining Camp, after suffering gross humiliation at the hands of the other cowboys and miners. Miss Lucy, the belle of the camp, is introduced to the Kid, and makes an impression; the Kid becomes quite seriously inclined towards her. The boys, more in the spirit of jest than chagrin, poke fun at him; call him the baby, and end with Jim Blake spanking him. Needless to say the Kid is mortified and swears to get square. A masque ball is to be held that night, so Bud plans his revenge. All tog out in grotesque costumes, a high old time is imminent, for it is fair to assume that the society folk of the camp will be well represented. Bud, however, feigns a toothache and will not go. Dressed up in carnival duds, the gang leaves the shack for the pavilion. All gone. Bud jumps from his bunk, and dresses up in swell female attire, the effect being marvelous. He presents such a striking appearance that he is the belle of the ball. Jim Blake becomes deeply smitten, and after leading him on Bud soon has Jim on his knees, pouring out his soul's devotion, regardless of the snickerings of the motley mob around them. There Jim kneels, declaring his undying love for the fair charmer, as only a lion-hearted cowboy can, when Bud removes his hat and wig. ""Holy ""Smoke!"" Well it is safe to say that Mr. James Blake will not attend any more spanking bees where the Kid is a victim.::Moving Picture World synopsis All the young men in the mining camp flirt with Lucy. Bud, the youngest of them, doesn't stand a chance. At a dance, Bud dresses as a woman and all the men flirt with him and abandon Lucy. When his disguise is revealed, the other men are too embarrassed to approach Lucy, and Bud dances the rest of the night with her.::Anonymous"
340;The Gibson Goddess;1909;D.W. Griffith;4.9;Comedy Short;"A pack of admirers won't leave a beautiful woman alone at a seaside resort, so she devises a plan. She appears in a leg-revealing swimsuit, but the stockings have been stuffed with cotton to make her limbs appear misshapen. All but one of the men is driven off, and regret it when she removes the misleading leggings.::Anonymous Nanette Renfrae, after an arduous season of society's whirl, decides to spend a quiet summer at a secluded seaside resort. The place selected is one frequented by the middle class, where she feels she will be free from the tormenting attentions of the male sex that her beauty has induced in the past. She arrives without ostentation accompanied only by her maid, but her extreme pulchritude and graceful bearing soon enraptured the male contingent of the place to the jealous rage of the other women folks who find themselves deserted. She cannot stir but what there is a score of admirers present. A walk on the beach, a stroll through the park is invariably attended by a regiment of gallants, until to her they become positive pests. One would have been acceptable, but twenty, well, it seems as if she is destined to pass time in the seclusion of her room. The maid, however, is ingenious and suggests a new way to get rid of the troublesome pests. She attires her mistress in a bathing suit and puts on her a hideous pair of stockings lined with raw cotton, which gives her a Gargantuan appearance, at least as to her nethers. Of course, the persistent tormentors flee in a panic when they behold; but, you know ""none but the brave deserve the fair,"" and Commodore Fitzmorris sticks, thereby making a decided impression upon Nanette. You may imagine the chagrin of the others when they learn of the hoax. Fitzie is now the favored one. As for the others, they are a disgruntled bunch, for the other girls, slighted before, turn cold shoulders on them.::Moving Picture World synopsis"
341;The Girls and Daddy;1909;D.W. Griffith;6.1;Short Drama;Portrays two teenage girls who are safeguarding money for their father and their reaction to a burglar's attempt to steal it.::Fiona Kelleghan <fkelleghan@aol.com> Two young women who live with their father are home alone, and are guarding a significant sum of money. While they are sleeping, a thief climbs in through the window and begins to rob their home. Even before he has left the premises, the two young women are confronted by another, more violent intruder.::Snow Leopard
342;The Golden Louis;1909;D.W. Griffith;5.9;Short Drama;"An anonymous donor drops a gold coin in the shoe of a homeless girl as she sleeps. A gambler with a 'sure thing' borrows the coin and wins a fortune, but he can't find her again to repay her.::Anonymous It was fête day in old Paris, and the city was the scene of gaiety and splendor. Contrasted with the brilliant throng we see a little child shivering in the snow, with her little wooden shoe held out expectant of a coin from those charitably disposed. But in the intoxicating jollity of the occasion the poor soul is passed by unnoticed until, exhausted, she sinks upon the stone step and sleeps. There now passes a kindly spirited knight, who flicks a Louis d'Or into the tiny wooden slipper at her side. Meanwhile, at the gambling house there has run to ruin at roulette a young blade, who is tipped that on the strike of twelve the number 17 is sure to come out. So impressed is he that he tries to borrow, in the hope of recouping his lost fortune, but his friends turn coldly away. From the place he saunters despondently and comes upon the little one on the step, still asleep. His hand, through habit, goes to his own pocket, hut, alas! It is empty. As he stands and contemplates the little one his eyes strikes the Louis d'Or. ""An Idea! I will borrow the coin, play 17, and win her a fortune."" Back to the hall he rushes, reaching there upon the stroke of twelve. Hurling the coin upon the table he yells ""17,"" and 17 wins. He lays his winnings and wins again. Again and again he doubles his wealth until the bank is broken. Back he goes to repay with interest the ""borrowed"" Louis, but what a sight greets him. ""Dead, and I have murdered her!"" and taking the death-stained gold he scatters it in the snow.::Moving Picture World synopsis As a frail young girl is outside begging in the snow, she collapses from weakness and from the cold. A well-dressed gentleman passes by and sees her, and he leaves a valuable gold coin in the shoe that she was using to collect alms. Meanwhile, at a gambling house nearby, another man is having a bad night and is becoming desperate. He walks outside, and he notices the girl and the coin. He could easily take it, but he is torn between his need and his pity for the girl.::Snow Leopard"
343;The Red Domino;1909;Viggo Larsen;3.5;Short Drama;"The Countess X. receives during a party a young man, who brings her a message from a friend, whom she believed to be in exile, asking her to come and see him the same evening in order to arrange with him how they can revenge themselves on their mutual enemy, the prince. The conversations is heard by a young diplomat, Baron Lerche, who has been concealed behind a curtain. He hurries away from the company and soon after returns in a different dress. He watches the countess, follows her in the night to a remote house, makes his way in, and overhears a plan to kill the prince. Soon after the prince gives a masked ball. The Countess, in Spanish costume, and the baron, in red domino, are among the guests. As the countess sees that the red domino keeps watching her, she boldly addresses him, takes his arm and leads him towards a group of guests, who are her friends and accomplices. There she writes, with the hands at her back, on her ball-card: ""Get the red domino out of the way."" The card is at once picked up, read and understood, and the next moment a lady takes, with irresistible amiability, the baron's arm and leads him to a remote smoking room. The baron is very much afraid to leave the dangerous countess out of sight, and is about to leave the room again, but two masked gentlemen throw him to the ground, gag and tie him and leave him alone. The baron, however, does not want to give up the exciting play. Straining every nerve, he succeeds in rolling himself on to a cigar-lighter, by aid of which be destroys his bonds. When he is free, he jumps out of the window and down in the garden summons two policemen, whom he had told to keep near the place, and then be goes back to the ballroom. In the meantime, the countess succeeds in getting the prince away from the party. He is very much captivated with her, and takes her to a cabinet, where he can speak to her alone. They get a bottle of champagne, and now the prince cannot keep back his feelings any longer, but falls down on his knees, declaring to her his love. The countess watches the opportunity; she smiles encouragingly, puts her left arm around his neck, and with the right hand she throws a poisonous powder in his glass. But at this very moment her arm is seized by the baron, who comes out from behind the curtain. The countess jumps to her feet, but when she sees that everything is out she falls back in a swoon. In a few words the baron explains what has happened. He calls the servants, who carry the countess out, and then he enters the ballroom again. With revolver in hand he makes the guests take off their masks, and now he points out the conspirators one by one. The policemen take them away, and the guests gather round the prince and baron with eager questions, but the prince answers smilingly: ""My dear guests, don't let this little incident disturb our pleasure; it was only an attempt on my life.""::Moving Picture World synopsis"
344;Hamlet, Prince of Denmark;1910;Gérard Bourgeois;5.2;Drama;Hamlet suspects his uncle has murdered his father to claim the throne of Denmark and the hand of Hamlet's mother, but the prince cannot decide whether or not he should take vengeance.
345;Hansel and Gretel;1909;J. Searle Dawley;4.4;Drama Short;"We are transported back to the little Dutch cottage in the woods and see little Hansel and Gretel and their parents, and we feel their hunger and are glad when their father starts out with the load of brooms, which they have just finished, to make some sales; and when we see the borrowed milk, which is to relieve their hunger until he returns, spilled on the floor and the children driven to the woods after berries, we know that fairies cannot be very far away and that something is going to happen. Soon we see the children wandering in the woods and beginning to be frightened as it grows late and strange, uncanny faces laugh at them from behind tree trunks and the rocks. We see them meet the sandman, who puts them to sleep and laughingly goes on his way, and then we are privileged to be the only ones who see what happens while they sleep. Suddenly the woods beyond them grow light with strange radiance and shining angels with their harps look down upon them and guard their slumbers; and when the night is done and the dawn approaches, we are the only ones who see the troops of fairies that discover them and awaken them with bells of flower cups and trumpets from the honeysuckle. But this is not all, for even though the day has dawned they are not out of danger. Soon we see the terrible old witch, who has finally found them, casting her spell over them and driving them, all unconscious of her presence, through the forest. We see her suddenly stop and hold up her hands and the marvelous house of gingerbread and frosting appears out of the thin air and takes shape before them! We see her put Hansel in a cage to be fattened that she may eat him later on, and then we see, but why tell the rest? Of course, the witch meets her deserts and everything ends happily both for Hansel and Gretel, and for the gingerbread children whom they bring back to life out of the witch's spell. The illusive and imaginative quality of the fairy tale has been fully preserved in this Edison production, and those who have read the story, or who have heard the opera, will find new interest in it and enjoy the original and logical denouement which comes as a surprise at the end.::Moving Picture World synopsis"
346;The Heart of an Outlaw;1909;D.W. Griffith;7.3;Short Western;A man gets revenge on his cheating wife by killing her and her lover. He thinks he has killed his daughter as well, but she survives and is adopted by the sheriff. A few years later the man, now an outlaw, ambushes the sheriff and plans to kidnap and murder the sheriff's daughter.::Anonymous
347;Her First Biscuits;1909;D.W. Griffith;5.7;Comedy Short;"A new bride has made a batch of biscuits. Her husband pretends to like them, so she delivers the rest to his office. But one bite of these biscuits makes you violently ill, and soon all his visitors (he runs a theatrical booking agency), plus the workmen at home, are ill; when she shows up at the office, they all go after her.::Jon Reeves <jreeves@imdb.com> Mrs. Jones with effusive enthusiasm felt that Eddie dear would appreciate her endeavors to prepare for him a batch of biscuits. That she followed the rules and directions set down in her text books is not questioned, but one bite from the lead-like disks was enough, and getting the dear little creature from the table by subterfuge he throws a full dozen of them through the window, pretending to have eaten them upon her return. Of course she is delighted at his apparent appreciation and when he has departed for the office she puts up a package of them and takes them there, placing them on his desk. Jones is not present at the time, he being in the adjoining room in the throes of indigestion. Visitors to his office, he being a theatrical agent and they hungry actors, espy the inviting looking dough boulders and partake greedily. In a short time the assemblage is a writhing, struggling, screaming mob. Meanwhile, at the Jones domicile the iceman, a housebreaker and the cop who trailed him all fall victims. Well, for a time it looked as if Mrs. Emma Jones was guilty of wholesale manslaughter. The trouble subsides, however, the victims convalesce and peace is restored when Mr. J. hurls, though with reluctance, the pernicious pabulum into the street.::Moving Picture World synopsis"
